text,disease,source_name,source_url,source_note
"high fever cough coryza conjunctivitis",measles,"CDC Measles Symptoms","https://www.cdc.gov/measles/signs-symptoms/index.html","CDC lists cough, coryza, and conjunctivitis as early symptoms."
"koplik spots inside mouth fever cough",measles,"CDC Measles Symptoms","https://www.cdc.gov/measles/signs-symptoms/index.html","CDC describes Koplik spots inside the mouth after symptoms begin."
"rash flat red spots face hairline spreads downward",measles,"CDC Measles Symptoms","https://www.cdc.gov/measles/signs-symptoms/index.html","CDC describes measles rash beginning on the face at the hairline and spreading downward."
"fever rash cough runny nose red eyes",measles,"CDC Measles Symptoms","https://www.cdc.gov/measles/signs-symptoms/index.html","Source-backed symptom combination from CDC measles symptoms."
"high fever red watery eyes rash",measles,"CDC Measles Symptoms","https://www.cdc.gov/measles/signs-symptoms/index.html","Source-backed symptom combination from CDC measles symptoms."
"cough runny nose conjunctivitis rash",measles,"CDC Measles Symptoms","https://www.cdc.gov/measles/signs-symptoms/index.html","Source-backed symptom combination from CDC measles symptoms."
"rash fever diarrhea ear infection",measles,"CDC Measles Symptoms","https://www.cdc.gov/measles/signs-symptoms/index.html","CDC lists diarrhea and ear infections as common measles complications."
